{
  "size": [
    16,
    16
  ],
  "materials": {
    "leaf": {
      "ramp": [
        "#1c3a14",
        "#2f6a22",
        "#4f9a34",
        "#7fcf52"
      ],
      "style": "organic"
    },
    "stem": {
      "ramp": [
        "#24160a",
        "#4a2e14",
        "#6a4420"
      ],
      "style": "flat"
    },
    "blood": {
      "ramp": [
        "#3a0408",
        "#7a0a14",
        "#b81c26",
        "#e24a4a"
      ],
      "style": "organic"
    },
    "orange": {
      "ramp": [
        "#5a2208",
        "#b04a12",
        "#e8781e",
        "#ffaa44",
        "#ffd894"
      ],
      "style": "organic"
    },
    "pith": {
      "ramp": [
        "#c8a888",
        "#f0dcc4",
        "#fff6ea"
      ],
      "style": "flat"
    }
  },
  "parts": {
    "o": "orange",
    "p": "pith",
    "r": "blood",
    "t": "stem",
    "l": "leaf"
  },
  "rows": [
    "................",
    "........tll.....",
    ".......t..l.....",
    ".....oooooo.....",
    "....oooooooo....",
    "...oooooooooo...",
    "..oooooooooooo..",
    "..oooooopppooo..",
    "..oooooprrrpoo..",
    "..ooooprrrrrpo..",
    "..ooooprrrrrpo..",
    "..ooooprrrrrpo..",
    "...ooooprrrpo...",
    "....oooopppo....",
    ".....oooooo.....",
    "................"
  ],
  "outline": "auto",
  "details": {
    "palette": {
      "w": "#fff0e0",
      "W": "#ff8a7a"
    },
    "rows": [
      "................",
      "................",
      "................",
      "................",
      "................",
      "................",
      "................",
      "................",
      "................",
      "........W.W.....",
      ".......W.w.W....",
      ".........W......",
      "................",
      "................",
      "................",
      "................"
    ]
  }
}
