{
  "size": [
    16,
    16
  ],
  "materials": {
    "dragon": {
      "ramp": [
        "#4a0a2a",
        "#a01a5a",
        "#e03a8a",
        "#ff7ab8",
        "#ffd0e8"
      ],
      "style": "organic"
    },
    "leaf": {
      "ramp": [
        "#1c3a14",
        "#2f6a22",
        "#4f9a34",
        "#7fcf52"
      ],
      "style": "organic"
    }
  },
  "parts": {
    "d": "dragon",
    "s": "leaf"
  },
  "rows": [
    "................",
    ".......s........",
    ".......sd.......",
    "..s..dddddd..s..",
    "...sdddddddds...",
    "...dddddddddd...",
    "...dddddddddd...",
    "...dddddddddd...",
    "..dddddddddddd..",
    ".ssddddddddddss.",
    "...dddddddddd...",
    "...dddddddddd...",
    "...dddddddddd...",
    "....sdddddds....",
    "...s.dddddd.s...",
    ".......dd......."
  ],
  "outline": "auto",
  "details": {
    "palette": {
      "k": "#ffd6ea"
    },
    "rows": [
      "................",
      "................",
      "................",
      "................",
      "................",
      "................",
      ".........k......",
      "......k.........",
      "................",
      "................",
      ".....k..k.......",
      "..........k.....",
      ".......k........",
      "................",
      "................",
      "................"
    ]
  }
}
