{
  "size": [
    16,
    16
  ],
  "materials": {
    "emberorb": {
      "ramp": [
        "#5a0f05",
        "#c43a0a",
        "#ff8a1a",
        "#ffd05a",
        "#fffbe0"
      ],
      "style": "glow"
    },
    "gold": {
      "ramp": [
        "#5a3a08",
        "#a6720f",
        "#e0b02a",
        "#fff0a0"
      ],
      "style": "metal"
    },
    "emberorb2": {
      "ramp": [
        "#7a1a05",
        "#e05010",
        "#ffaa30",
        "#ffe27a",
        "#ffffff"
      ],
      "style": "glow"
    },
    "wood": {
      "ramp": [
        "#2e1c0c",
        "#5c3a18",
        "#7d5224",
        "#9c6b32",
        "#bd8a48"
      ],
      "style": "wood"
    }
  },
  "parts": {
    "w": "wood",
    "g": "gold",
    "o": "emberorb",
    "O": "emberorb2"
  },
  "rows": [
    "................",
    "................",
    "...........ooo..",
    "..........ooooo.",
    ".........gooooo.",
    ".........g.ooog.",
    "..........g...g.",
    ".........w...g..",
    "........w.......",
    ".......g........",
    "......w.........",
    ".....w..........",
    "....g...........",
    "...w............",
    "..ww............",
    ".ww............."
  ],
  "outline": "auto",
  "frames": [
    {
      "rows": [
        "................",
        "................",
        "...........ooo..",
        "..........ooooo.",
        ".........gooooo.",
        ".........g.ooog.",
        "..........g...g.",
        ".........w...g..",
        "........w.......",
        ".......g........",
        "......w.........",
        ".....w..........",
        "....g...........",
        "...w............",
        "..ww............",
        ".ww............."
      ],
      "details": {
        "palette": {
          "y": "#fff6c8"
        },
        "rows": [
          "..............y.",
          ".........y......",
          "................",
          "............y...",
          "................",
          "................",
          "................",
          "................",
          "................",
          "................",
          "................",
          "................",
          "................",
          "................",
          "................",
          "................"
        ]
      }
    },
    {
      "rows": [
        "................",
        "................",
        "...........OOO..",
        "..........OOOOO.",
        ".........gOOOOO.",
        ".........g.OOOg.",
        "..........g...g.",
        ".........w...g..",
        "........w.......",
        ".......g........",
        "......w.........",
        ".....w..........",
        "....g...........",
        "...w............",
        "..ww............",
        ".ww............."
      ],
      "details": {
        "palette": {
          "y": "#fff6c8"
        },
        "rows": [
          "..........y.....",
          "................",
          "...............y",
          ".............y..",
          "................",
          "................",
          "................",
          "................",
          "................",
          "................",
          "................",
          "................",
          "................",
          "................",
          "................",
          "................"
        ]
      }
    },
    {
      "rows": [
        "................",
        "................",
        "...........ooo..",
        "..........ooooo.",
        ".........gooooo.",
        ".........g.ooog.",
        "..........g...g.",
        ".........w...g..",
        "........w.......",
        ".......g........",
        "......w.........",
        ".....w..........",
        "....g...........",
        "...w............",
        "..ww............",
        ".ww............."
      ],
      "details": {
        "palette": {
          "y": "#fff6c8"
        },
        "rows": [
          ".............y..",
          "................",
          "........y.......",
          "............y...",
          "................",
          "................",
          "................",
          "................",
          "................",
          "................",
          "................",
          "................",
          "................",
          "................",
          "................",
          "................"
        ]
      }
    },
    {
      "rows": [
        "................",
        "................",
        "...........OOO..",
        "..........OOOOO.",
        ".........gOOOOO.",
        ".........g.OOOg.",
        "..........g...g.",
        ".........w...g..",
        "........w.......",
        ".......g........",
        "......w.........",
        ".....w..........",
        "....g...........",
        "...w............",
        "..ww............",
        ".ww............."
      ],
      "details": {
        "palette": {
          "y": "#fff6c8"
        },
        "rows": [
          "...........y....",
          "...............y",
          "................",
          ".............y..",
          "................",
          "................",
          "................",
          "................",
          "................",
          "................",
          "................",
          "................",
          "................",
          "................",
          "................",
          "................"
        ]
      }
    }
  ],
  "frametime": 3
}
