{
  "size": [
    16,
    16
  ],
  "materials": {
    "star": {
      "ramp": [
        "#5a5a10",
        "#a8a81c",
        "#e6e03a",
        "#fff78a",
        "#fffde0"
      ],
      "style": "organic"
    }
  },
  "parts": {
    "s": "star"
  },
  "rows": [
    "................",
    "................",
    ".......ss.......",
    ".......ss.......",
    "......ssss......",
    ".......ss.......",
    "..ssssssssssss..",
    "...ssssssssss...",
    "....ssssssss....",
    ".....ssssss.....",
    "....ssssssss....",
    "....ssssssss....",
    "....ssssssss....",
    "....s.ssss.s....",
    "................",
    "................"
  ],
  "outline": "auto",
  "details": {
    "palette": {
      "c": "#fff8c0"
    },
    "rows": [
      "................",
      "................",
      "................",
      "................",
      "................",
      "................",
      "................",
      ".......c........",
      "......c.c.......",
      ".......c........",
      "................",
      "................",
      "................",
      "................",
      "................",
      "................"
    ]
  }
}
