{
  "size": [
    16,
    16
  ],
  "materials": {
    "bone": {
      "ramp": [
        "#6e6450",
        "#a89a7c",
        "#d8ccaa",
        "#f4ecd2"
      ],
      "style": "bone"
    },
    "edge": {
      "ramp": [
        "#7d8794",
        "#b7c1cc",
        "#e6ecf2",
        "#ffffff"
      ],
      "style": "metal"
    },
    "rust": {
      "ramp": [
        "#2a120a",
        "#5a2a14",
        "#8a4422",
        "#b8662e"
      ],
      "style": "metal"
    },
    "leather": {
      "ramp": [
        "#24130a",
        "#4c2c16",
        "#6a3f20",
        "#8a542c"
      ],
      "style": "leather"
    }
  },
  "parts": {
    "c": "edge",
    "C": "bone",
    "r": "rust",
    "h": "leather"
  },
  "rows": [
    "..............c.",
    ".............ccC",
    "............ccCC",
    "...........c..CC",
    "..........ccCCCC",
    ".........ccCCCCC",
    "........ccCCCCC.",
    ".......ccCCCCC..",
    "........CCCCC...",
    "...rr....CCC....",
    ".....r....C.....",
    "..hh..r.........",
    ".hh.............",
    ".h..............",
    "rr..............",
    "r..............."
  ],
  "outline": "auto"
}
