{
  "size": [
    16,
    16
  ],
  "materials": {
    "aurumdark": {
      "ramp": [
        "#2a2016",
        "#4a3a26",
        "#6f5a3c",
        "#a08458"
      ],
      "style": "metal"
    },
    "wood": {
      "ramp": [
        "#2e1c0c",
        "#5c3a18",
        "#7d5224",
        "#9c6b32",
        "#bd8a48"
      ],
      "style": "wood"
    },
    "aurum": {
      "ramp": [
        "#3c2a10",
        "#8a6420",
        "#d4a43a",
        "#f6d470",
        "#fff6c8"
      ],
      "style": "metal"
    }
  },
  "parts": {
    "w": "wood",
    "a": "aurum",
    "h": "aurum",
    "H": "aurumdark"
  },
  "rows": [
    "................",
    "................",
    "......hhhhhhh...",
    "......hHHHHHh...",
    "...........wh...",
    "..........w.....",
    ".........w......",
    "........a.......",
    ".......w........",
    "......w.........",
    ".....w..........",
    "....a...........",
    "...w............",
    "..w.............",
    "aw..............",
    "aa.............."
  ],
  "outline": "auto"
}
